{ "id": "kita-trauma",
  "name": "KitaTrauma",
  "shortName": "KITA",
  "color": "#eb5153",
  "categories": {
    "sprint": [
      { "trainer": "Rose",
        "locked": true,
        "uma": { "name": "Nishino Flower",
          "spriteId": 105101,
          "rating": "UG4",
          "style": "pace",
          "aptitudes": { "terrain": "A", "distance": "A", "style": "A" },
          "stats": { "speed": 1305, "stamina": 593, "power": 1295, "guts": 515, "wisdom": 1305 },
          "skills": ["Budding Blossom","Shooting for Victory!","Corner Acceleration","Straightaway Acceleration","It's On!","Homestretch Haste","Speed Star","Turbo Sprint","Sprint Straightaways","Pace Chaser Corners","Determined Descent","Highlander","Tail Held High","Neck and Neck"] }
      },
      { "trainer": "Oguging",
        "locked": true,
        "uma": { "name": "Sakura Bakushin O",
          "spriteId": 104101,
          "rating": "UG3",
          "style": "pace",
          "aptitudes": { "terrain": "S", "distance": "A", "style": "A" },
          "stats": { "speed": 1300, "stamina": 501, "power": 1234, "guts": 426, "wisdom": 1325 },
          "skills": ["Genius x Bakushin = Victory","Shooting for Victory!","Budding Blossom","Professor of Curvature","Straightaway Adept","It's On!","Prepared to Pass","Turbo Sprint","Countermeasure","Meticulous Measures","Pace Chaser Straightaways","Straight Descent","Neck and Neck","On the Attack","Burning Spirit SPD"] }
      },
      { "trainer": "New Team sprint 3",
        "uma": { "name": "Uma Name",
          "characterId": "",
          "rating": "S",
          "style": "front",
          "aptitudes": { "terrain": "A", "distance": "A", "style": "A" },
          "stats": { "speed": 0, "stamina": 0, "power": 0, "guts": 0, "wisdom": 0 },
          "skills": [] }
      }
    ],
    "mile": [
      { "trainer": "Elita",
        "locked": true,
        "uma": { "name": "Maruzensky",
          "spriteId": 100402,
          "rating": "UG5",
          "style": "front",
          "aptitudes": { "terrain": "A", "distance": "S", "style": "A" },
          "stats": { "speed": 1302, "stamina": 611, "power": 1220, "guts": 535, "wisdom": 1314 },
          "skills": ["A Kiss for Courage","Angling and Scheming","Operation Cacao","Non-Standard Distance","Wet Conditions","Professor of Curvature","Corner Recovery","Straightaway Adept","Homestretch Haste","Taking the Lead","Fast-Paced","Mile Maven","Mile Straightaways","Mile Corners","Shifting Gears","Front Runner Corners","Dodging Danger","Groundwork","Tail Held High","Lone Wolf","Burning Spirit SPD","Ignited Spirit WIT"] }
      },
      { "trainer": "Fluwid",
        "locked": true,
        "uma": { "name": "Silence Suzuka",
          "spriteId": 100201,
          "rating": "UG2",
          "style": "front",
          "aptitudes": { "terrain": "A", "distance": "S", "style": "A" },
          "stats": { "speed": 1219, "stamina": 870, "power": 1219, "guts": 707, "wisdom": 1004 },
          "skills": ["The View from the Lead is Mine!","Angling and Scheming","Operation Cacao","Runaway","Right-Handed","Professor of Curvature","Concentration","Taking the Lead","Escape Artist","Mile Straightaways","Front Runner Straightaways","Front Runner Corners","Front Runner Savvy","Groundwork","Playtime's Over!","Burning Spirit SPD","Ignited Spirit PWR","Ignited Spirit WIT"] }
      },
      { "trainer": "New Team mile 3",
        "uma": { "name": "Uma Name",
          "characterId": "",
          "rating": "S",
          "style": "front",
          "aptitudes": { "terrain": "A", "distance": "A", "style": "A" },
          "stats": { "speed": 0, "stamina": 0, "power": 0, "guts": 0, "wisdom": 0 },
          "skills": [] }
      }
    ],
    "medium": [
      { "trainer": "ThatGuyMark",
        "locked": true,
        "uma": { "name": "Mejiro Ardan",
          "spriteId": 107101,
          "rating": "UG5",
          "style": "pace",
          "aptitudes": { "terrain": "A", "distance": "S", "style": "A" },
          "stats": { "speed": 1256, "stamina": 840, "power": 1209, "guts": 482, "wisdom": 1228 },
          "skills": ["A Lifelong Dream, A Moment's Flight","Shooting Star","Triumphant Pulse","Shadow Break","Right-Handed","Professor of Curvature","Straightaway Adept","It's On!","No Stopping Me!","Speed Star","Refraction Arc","Pace Chaser Straightaways","Pace Chaser Corners","Determined Descent","Tail Held High","Slipstream","Playtime's Over!","Come What May"] }
      },
      { "trainer": "North",
        "locked": true,
        "uma": { "name": "Mihono Bourbon",
          "spriteId": 102602,
          "rating": "UG4",
          "style": "front",
          "aptitudes": { "terrain": "S", "distance": "S", "style": "A" },
          "stats": { "speed": 1302, "stamina": 741, "power": 1194, "guts": 503, "wisdom": 1285 },
          "skills": ["Operation Cacao","Angling and Scheming","Right-Handed","Wet Conditions","Spring Runner","Professor of Curvature","Swinging Maestro","Straightaway Adept","Prudent Positioning","Early Lead","Escape Artist","Medium Straightaways","Medium Corners","Dodging Danger","Top Runner","Groundwork","Tail Held High","Burning Spirit SPD"] }
      },
      { "trainer": "New Team medium 3",
        "uma": { "name": "Uma Name",
          "characterId": "",
          "rating": "S",
          "style": "front",
          "aptitudes": { "terrain": "A", "distance": "A", "style": "A" },
          "stats": { "speed": 0, "stamina": 0, "power": 0, "guts": 0, "wisdom": 0 },
          "skills": [] }
      }
    ],
    "long": [
      { "trainer": "Sharky",
        "locked": true,
        "uma": { "name": "Kitasan Black",
          "spriteId": 106801,
          "rating": "UG",
          "style": "front",
          "aptitudes": { "terrain": "S", "distance": "S", "style": "A" },
          "stats": { "speed": 1281, "stamina": 921, "power": 1103, "guts": 508, "wisdom": 1024 },
          "skills": ["Victory Cheer!","Break It Down!","Right-Handed","Wet Conditions","Spring Runner","Outer Post Proficiency","Swinging Maestro","Prudent Positioning","Taking the Lead","Fast-Paced","Cooldown","Blast Forward","Keeping the Lead","Front Runner Corners","Dodging Danger","Top Runner","Groundwork","Firm Resolve","Burning Spirit SPD"] }
      },
      { "trainer": "New Team long 2",
        "uma": { "name": "Uma Name",
          "characterId": "",
          "rating": "S",
          "style": "front",
          "aptitudes": { "terrain": "A", "distance": "A", "style": "A" },
          "stats": { "speed": 0, "stamina": 0, "power": 0, "guts": 0, "wisdom": 0 },
          "skills": [] }
      },
      { "trainer": "New Team long 3",
        "uma": { "name": "Uma Name",
          "characterId": "",
          "rating": "S",
          "style": "front",
          "aptitudes": { "terrain": "A", "distance": "A", "style": "A" },
          "stats": { "speed": 0, "stamina": 0, "power": 0, "guts": 0, "wisdom": 0 },
          "skills": [] }
      }
    ],
    "dirt": [
      { "trainer": "Nutrition",
        "locked": true,
        "uma": { "name": "Haru Urara",
          "spriteId": 105202,
          "rating": "UG6",
          "style": "late",
          "aptitudes": { "terrain": "A", "distance": "S", "style": "A" },
          "stats": { "speed": 1262, "stamina": 556, "power": 1238, "guts": 746, "wisdom": 1292 },
          "skills": ["114th Time's the Charm","Budding Blossom","Louder! Tracen Cheer!","Right-Handed","Rainy Days","Outer Post Proficiency","Straightaway Acceleration","It's On!","No Stopping Me!","Fast & Furious","On Your Left!","Turbo Sprint","Meticulous Measures","Late Surger Corners","Lucky Seven","Tail Held High","Full Throttle","Burning Spirit PWR","Racing Spirit: Speed","Racing Spirit: Stamina","Racing Spirit: Wit"] }
      },
      { "trainer": "Yasue",
        "locked": true,
        "uma": { "name": "Taiki Shuttle",
          "spriteId": 101002,
          "rating": "UG5",
          "style": "pace",
          "aptitudes": { "terrain": "A", "distance": "A", "style": "A" },
          "stats": { "speed": 1229, "stamina": 381, "power": 1146, "guts": 1049, "wisdom": 1240 },
          "skills": ["Joyful Voyage","Shooting Star","Victoria por plancha ☆","Budding Blossom","Right-Handed","Wet Conditions","Fall Runner","Professor of Curvature","Corner Acceleration","Straightaway Adept","It's On!","Nimble Navigator","Sprinting Gear","Sprint Corners","Pace Chaser Corners","Neck and Neck","In High Spirits","Burning Spirit SPD","Ignited Spirit PWR","Ignited Spirit GUTS"] }
      },
      { "trainer": "New Team dirt 3",
        "uma": { "name": "Uma Name",
          "characterId": "",
          "rating": "S",
          "style": "front",
          "aptitudes": { "terrain": "A", "distance": "A", "style": "A" },
          "stats": { "speed": 0, "stamina": 0, "power": 0, "guts": 0, "wisdom": 0 },
          "skills": [] }
      }
    ]
  }
}
