{
  "id": "umamusuko",
  "name": "Umamusuko",
  "shortName": "USK",
  "tagline": "",
  "color": "#f1c41f",
  "categories": {
    "sprint": [
      {
        "slot": 0,
        "trainer": "New Team sprint 1",
        "locked": false,
        "uma": {
          "name": "Uma Name",
          "rating": "S",
          "style": "front",
          "aptitudes": {
            "terrain": "A",
            "distance": "A",
            "style": "A"
          },
          "stats": {
            "speed": 0,
            "stamina": 0,
            "power": 0,
            "guts": 0,
            "wisdom": 0
          },
          "skills": [],
          "characterId": "",
          "spriteId": "",
          "spritePath": null
        }
      },
      {
        "slot": 1,
        "trainer": "New Team sprint 2",
        "locked": false,
        "uma": {
          "name": "Uma Name",
          "rating": "S",
          "style": "front",
          "aptitudes": {
            "terrain": "A",
            "distance": "A",
            "style": "A"
          },
          "stats": {
            "speed": 0,
            "stamina": 0,
            "power": 0,
            "guts": 0,
            "wisdom": 0
          },
          "skills": [],
          "characterId": "",
          "spriteId": "",
          "spritePath": null
        }
      },
      {
        "slot": 2,
        "trainer": "New Team sprint 3",
        "locked": false,
        "uma": {
          "name": "Uma Name",
          "rating": "S",
          "style": "front",
          "aptitudes": {
            "terrain": "A",
            "distance": "A",
            "style": "A"
          },
          "stats": {
            "speed": 0,
            "stamina": 0,
            "power": 0,
            "guts": 0,
            "wisdom": 0
          },
          "skills": [],
          "characterId": "",
          "spriteId": "",
          "spritePath": null
        }
      }
    ],
    "mile": [
      {
        "slot": 0,
        "trainer": "New Team mile 1",
        "locked": false,
        "uma": {
          "name": "Uma Name",
          "rating": "S",
          "style": "front",
          "aptitudes": {
            "terrain": "A",
            "distance": "A",
            "style": "A"
          },
          "stats": {
            "speed": 0,
            "stamina": 0,
            "power": 0,
            "guts": 0,
            "wisdom": 0
          },
          "skills": [],
          "characterId": "",
          "spriteId": "",
          "spritePath": null
        }
      },
      {
        "slot": 1,
        "trainer": "New Team mile 2",
        "locked": false,
        "uma": {
          "name": "Uma Name",
          "rating": "S",
          "style": "front",
          "aptitudes": {
            "terrain": "A",
            "distance": "A",
            "style": "A"
          },
          "stats": {
            "speed": 0,
            "stamina": 0,
            "power": 0,
            "guts": 0,
            "wisdom": 0
          },
          "skills": [],
          "characterId": "",
          "spriteId": "",
          "spritePath": null
        }
      },
      {
        "slot": 2,
        "trainer": "New Team mile 3",
        "locked": false,
        "uma": {
          "name": "Uma Name",
          "rating": "S",
          "style": "front",
          "aptitudes": {
            "terrain": "A",
            "distance": "A",
            "style": "A"
          },
          "stats": {
            "speed": 0,
            "stamina": 0,
            "power": 0,
            "guts": 0,
            "wisdom": 0
          },
          "skills": [],
          "characterId": "",
          "spriteId": "",
          "spritePath": null
        }
      }
    ],
    "medium": [
      {
        "slot": 0,
        "trainer": "New Team medium 1",
        "locked": false,
        "uma": {
          "name": "Uma Name",
          "rating": "S",
          "style": "front",
          "aptitudes": {
            "terrain": "A",
            "distance": "A",
            "style": "A"
          },
          "stats": {
            "speed": 0,
            "stamina": 0,
            "power": 0,
            "guts": 0,
            "wisdom": 0
          },
          "skills": [],
          "characterId": "",
          "spriteId": "",
          "spritePath": null
        }
      },
      {
        "slot": 1,
        "trainer": "New Team medium 2",
        "locked": false,
        "uma": {
          "name": "Uma Name",
          "rating": "S",
          "style": "front",
          "aptitudes": {
            "terrain": "A",
            "distance": "A",
            "style": "A"
          },
          "stats": {
            "speed": 0,
            "stamina": 0,
            "power": 0,
            "guts": 0,
            "wisdom": 0
          },
          "skills": [],
          "characterId": "",
          "spriteId": "",
          "spritePath": null
        }
      },
      {
        "slot": 2,
        "trainer": "New Team medium 3",
        "locked": false,
        "uma": {
          "name": "Uma Name",
          "rating": "S",
          "style": "front",
          "aptitudes": {
            "terrain": "A",
            "distance": "A",
            "style": "A"
          },
          "stats": {
            "speed": 0,
            "stamina": 0,
            "power": 0,
            "guts": 0,
            "wisdom": 0
          },
          "skills": [],
          "characterId": "",
          "spriteId": "",
          "spritePath": null
        }
      }
    ],
    "long": [
      {
        "slot": 0,
        "trainer": "New Team long 1",
        "locked": false,
        "uma": {
          "name": "Uma Name",
          "rating": "S",
          "style": "front",
          "aptitudes": {
            "terrain": "A",
            "distance": "A",
            "style": "A"
          },
          "stats": {
            "speed": 0,
            "stamina": 0,
            "power": 0,
            "guts": 0,
            "wisdom": 0
          },
          "skills": [],
          "characterId": "",
          "spriteId": "",
          "spritePath": null
        }
      },
      {
        "slot": 1,
        "trainer": "New Team long 2",
        "locked": false,
        "uma": {
          "name": "Uma Name",
          "rating": "S",
          "style": "front",
          "aptitudes": {
            "terrain": "A",
            "distance": "A",
            "style": "A"
          },
          "stats": {
            "speed": 0,
            "stamina": 0,
            "power": 0,
            "guts": 0,
            "wisdom": 0
          },
          "skills": [],
          "characterId": "",
          "spriteId": "",
          "spritePath": null
        }
      },
      {
        "slot": 2,
        "trainer": "New Team long 3",
        "locked": false,
        "uma": {
          "name": "Uma Name",
          "rating": "S",
          "style": "front",
          "aptitudes": {
            "terrain": "A",
            "distance": "A",
            "style": "A"
          },
          "stats": {
            "speed": 0,
            "stamina": 0,
            "power": 0,
            "guts": 0,
            "wisdom": 0
          },
          "skills": [],
          "characterId": "",
          "spriteId": "",
          "spritePath": null
        }
      }
    ],
    "dirt": [
      {
        "slot": 0,
        "trainer": "New Team dirt 1",
        "locked": false,
        "uma": {
          "name": "Uma Name",
          "rating": "S",
          "style": "front",
          "aptitudes": {
            "terrain": "A",
            "distance": "A",
            "style": "A"
          },
          "stats": {
            "speed": 0,
            "stamina": 0,
            "power": 0,
            "guts": 0,
            "wisdom": 0
          },
          "skills": [],
          "characterId": "",
          "spriteId": "",
          "spritePath": null
        }
      },
      {
        "slot": 1,
        "trainer": "New Team dirt 2",
        "locked": false,
        "uma": {
          "name": "Uma Name",
          "rating": "S",
          "style": "front",
          "aptitudes": {
            "terrain": "A",
            "distance": "A",
            "style": "A"
          },
          "stats": {
            "speed": 0,
            "stamina": 0,
            "power": 0,
            "guts": 0,
            "wisdom": 0
          },
          "skills": [],
          "characterId": "",
          "spriteId": "",
          "spritePath": null
        }
      },
      {
        "slot": 2,
        "trainer": "New Team dirt 3",
        "locked": false,
        "uma": {
          "name": "Uma Name",
          "rating": "S",
          "style": "front",
          "aptitudes": {
            "terrain": "A",
            "distance": "A",
            "style": "A"
          },
          "stats": {
            "speed": 0,
            "stamina": 0,
            "power": 0,
            "guts": 0,
            "wisdom": 0
          },
          "skills": [],
          "characterId": "",
          "spriteId": "",
          "spritePath": null
        }
      }
    ]
  }
}
