{ "id": "umamusuko",
  "name": "Umamusuko",
  "shortName": "USK",
  "color": "#f1c41f",
  "categories": {
    "sprint": [
      { "trainer": "Aur0x",
        "locked": true,
        "uma": { "name": "Curren Chan",
          "spriteId": 103802,
          "rating": "SS",
          "style": "pace",
          "aptitudes": { "terrain": "A", "distance": "A", "style": "A" },
          "stats": { "speed": 1238, "stamina": 401, "power": 1191, "guts": 474, "wisdom": 1259 },
          "skills": ["One True Color","Right-Handed","Standard Distance","Professor of Curvature","Straightaway Adept","Ramp Up","In Body and Mind","Speed Star","Turbo Sprint","Pace Chaser Savvy","Uma Stan","Light as a Feather","Burning Spirit SPD","Ignited Spirit WIT"] }
      },
      { "trainer": "RTemp35T",
        "locked": true,
        "uma": { "name": "Sakura Chiyono O",
          "spriteId": 106901,
          "rating": "UG4",
          "style": "pace",
          "aptitudes": { "terrain": "S", "distance": "S", "style": "A" },
          "stats": { "speed": 1293, "stamina": 492, "power": 1173, "guts": 902, "wisdom": 1227 },
          "skills": ["Ambition to Surpass the Sakura","Shooting for Victory!","Budding Blossom","Right-Handed","Firm Conditions","Wet Conditions","Corner Adept","Straightaway Adept","It's On!","Nimble Navigator","Homestretch Haste","Speed Star","Sprint Straightaways","Pace Chaser Savvy","Uma Stan","Groundwork","In High Spirits","Burning Spirit SPD","Ignited Spirit PWR"] }
      },
      { "trainer": "Ylgr",
        "locked": true,
        "uma": { "name": "Nishino Flower",
          "spriteId": 105101,
          "rating": "UG5",
          "style": "pace",
          "aptitudes": { "terrain": "A", "distance": "A", "style": "A" },
          "stats": { "speed": 1314, "stamina": 549, "power": 1261, "guts": 958, "wisdom": 1096 },
          "skills": ["Budding Blossom","Shooting for Victory!","Barcarole of Blessings","Corner Adept","Beeline Burst","It's On!","Speed Star","Sprinting Gear","Sprint Corners","Countermeasure","Pace Chaser Straightaways","Pace Chaser Corners","Straight Descent","Head-On","In High Spirits","Burning Spirit SPD","Ignited Spirit PWR","Ignited Spirit GUTS"] }
      }
    ],
    "mile": [
      { "trainer": "AzimDaQuixote",
        "locked": true,
        "uma": { "name": "Agnes Digital",
          "spriteId": 101901,
          "rating": "UG1",
          "style": "late",
          "aptitudes": { "terrain": "A", "distance": "S", "style": "A" },
          "stats": { "speed": 1215, "stamina": 700, "power": 1213, "guts": 619, "wisdom": 1244 },
          "skills": ["OMG! (ﾟ∀ﾟ) The Final Sprint! ☆","Let's Pump Some Iron!","Moving Past, and Beyond","Right-Handed","Wet Conditions","Professor of Curvature","It's On!","No Stopping Me!","On Your Left!","Mile Corners","Late Surger Straightaways","Superstan","Tail Held High","Burning Spirit SPD"] }
      },
      { "trainer": "Special Needs",
        "locked": true,
        "uma": { "name": "Maruzensky",
          "spriteId": 100401,
          "rating": "UG2",
          "style": "front",
          "aptitudes": { "terrain": "A", "distance": "S", "style": "A" },
          "stats": { "speed": 1242, "stamina": 632, "power": 1197, "guts": 398, "wisdom": 1354 },
          "skills": ["A Kiss for Courage","Angling and Scheming","Operation Cacao","Right-Handed","Hakodate Racecourse","Wet Conditions","Winter Runner","Professor of Curvature","Corner Recovery","Focus","Taking the Lead","Fast-Paced","Mile Maven","Front Runner Straightaways","Front Runner Savvy","Triple 7s","Groundwork","Tail Held High","Ignited Spirit SPD"] }
      },
      { "trainer": "InfinitumX",
        "locked": true,
        "uma": { "name": "Tamamo Cross",
          "spriteId": 102101,
          "rating": "UG4",
          "style": "late",
          "aptitudes": { "terrain": "A", "distance": "S", "style": "A" },
          "stats": { "speed": 1289, "stamina": 518, "power": 1282, "guts": 462, "wisdom": 1296 },
          "skills": ["White Lightning Comin' Through!","Let's Pump Some Iron!","Moving Past, and Beyond","Right-Handed","Wet Conditions","Winter Runner","Professor of Curvature","Corner Recovery","It's On!","No Stopping Me!","Homestretch Haste","Fast & Furious","On Your Left!","Updrafters","Uma Stan","Tail Nine","Burning Spirit SPD"] }
      }
    ],
    "medium": [
      { "trainer": "Toly",
        "locked": true,
        "uma": { "name": "Rice Shower",
          "spriteId": 103001,
          "rating": "UG4",
          "style": "pace",
          "aptitudes": { "terrain": "A", "distance": "S", "style": "A" },
          "stats": { "speed": 1265, "stamina": 860, "power": 1113, "guts": 698, "wisdom": 1209 },
          "skills": ["Blue Rose Closer","Triumphant Pulse","Kyoto Racecourse","Professor of Curvature","It's On!","No Stopping Me!","Prepared to Pass","Up-Tempo","Refraction Arc","Determined Descent","Highlander","Uma Stan","Tail Held High","Playtime's Over!","Burning Spirit SPD","Ignited Spirit PWR","Ignited Spirit GUTS","Racing Spirit: Stamina"] }
      },
      { "trainer": "Crownsliver",
        "locked": true,
        "uma": { "name": "Gold Ship",
          "spriteId": 100701,
          "rating": "UG1",
          "style": "end",
          "aptitudes": { "terrain": "A", "distance": "S", "style": "A" },
          "stats": { "speed": 1269, "stamina": 789, "power": 1106, "guts": 657, "wisdom": 1110 },
          "skills": ["Anchors Aweigh!","Let's Pump Some Iron!","Moving Past, and Beyond","Spring Runner","Professor of Curvature","Rushing Gale!","It's On!","Nimble Navigator","Straightaway Spurt","Refraction Arc","End Closer Corners","Go-Home Specialist","Uma Stan","Daring Strike","Fighting Spirit","Ignited Spirit GUTS"] }
      },
      { "trainer": "Zerreth",
        "locked": true,
        "uma": { "name": "Daiwa Scarlet",
          "spriteId": 100901,
          "rating": "UG4",
          "style": "pace",
          "aptitudes": { "terrain": "A", "distance": "S", "style": "A" },
          "stats": { "speed": 1230, "stamina": 792, "power": 1239, "guts": 546, "wisdom": 1181 },
          "skills": ["Resplendent Red Ace","Budding Blossom","Right-Handed","Spring Runner","Professor of Curvature","It's On!","No Stopping Me!","Homestretch Haste","Preferred Position","Prepared to Pass","Productive Plan","Killer Tunes","Steadfast","Refraction Arc","Highlander","Head-On","Ignited Spirit SPD","Burning Spirit PWR"] }
      }
    ],
    "long": [
      { "trainer": "Yozu",
        "locked": true,
        "uma": { "name": "Mayano Top Gun",
          "spriteId": 102401,
          "rating": "UG1",
          "style": "end",
          "aptitudes": { "terrain": "A", "distance": "S", "style": "A" },
          "stats": { "speed": 12940, "stamina": 1086, "power": 951, "guts": 606, "wisdom": 1166 },
          "skills": ["Flashy☆Landing","Triumphant Pulse","Let's Pump Some Iron!","Right-Handed","Spring Runner","Sunny Days","Corner Recovery","Rushing Gale!","It's On!","No Stopping Me!","Straightaway Spurt","Long Corners","Daring Strike","Burning Spirit SPD","Ignited Spirit GUTS"] }
      },
      { "trainer": "Shin",
        "locked": true,
        "uma": { "name": "Mejiro McQueen",
          "spriteId": 101301,
          "rating": "UG2",
          "style": "pace",
          "aptitudes": { "terrain": "S", "distance": "S", "style": "A" },
          "stats": { "speed": 1226, "stamina": 1178, "power": 1177, "guts": 688, "wisdom": 983 },
          "skills": ["The Duty of Dignity Calls","Triumphant Pulse","Barcarole of Blessings","Right-Handed","Firm Conditions","Professor of Curvature","Swinging Maestro","Rushing Gale!","It's On!","Nimble Navigator","Long Corners","Neck and Neck","Burning Spirit SPD"] }
      },
      { "trainer": "New Team long 3",
        "uma": { "name": "Uma Name",
          "characterId": "",
          "rating": "S",
          "style": "front",
          "aptitudes": { "terrain": "A", "distance": "A", "style": "A" },
          "stats": { "speed": 0, "stamina": 0, "power": 0, "guts": 0, "wisdom": 0 },
          "skills": [] }
      }
    ],
    "dirt": [
      { "trainer": "Tenosaki",
        "locked": true,
        "uma": { "name": "Oguri Cap",
          "spriteId": 100601,
          "rating": "UG2",
          "style": "pace",
          "aptitudes": { "terrain": "A", "distance": "S", "style": "A" },
          "stats": { "speed": 1303, "stamina": 483, "power": 1214, "guts": 942, "wisdom": 1037 },
          "skills": ["Triumphant Pulse","Shooting for Victory!","Budding Blossom","Right-Handed","Firm Conditions","Wet Conditions","Summer Runner","Corner Adept","It's On!","Sprinting Gear","Sprint Straightaways","Pace Chaser Corners","Pace Chaser Savvy","Uma Stan","Groundwork","Slipstream","Nothing Ventured","In High Spirits","Burning Spirit SPD","Ignited Spirit PWR"] }
      },
      { "trainer": "Brian",
        "locked": true,
        "uma": { "name": "Taiki Shuttle",
          "spriteId": 101001,
          "rating": "UG",
          "style": "pace",
          "aptitudes": { "terrain": "A", "distance": "S", "style": "A" },
          "stats": { "speed": 1182, "stamina": 575, "power": 1233, "guts": 513, "wisdom": 1270 },
          "skills": ["Shooting for Victory!","Triumphant Pulse","Budding Blossom","564 Escapades","It's On!","No Stopping Me!","Homestretch Haste","Prepared to Pass","Sprinting Gear","Sprint Straightaways","Pace Chaser Corners","Straight Descent","Tail Held High","Forward, March!","Neck and Neck","Sunny Sign","Burning Spirit SPD","Ignited Spirit PWR"] }
      },
      { "trainer": "New Team dirt 3",
        "uma": { "name": "Uma Name",
          "characterId": "",
          "rating": "S",
          "style": "front",
          "aptitudes": { "terrain": "A", "distance": "A", "style": "A" },
          "stats": { "speed": 0, "stamina": 0, "power": 0, "guts": 0, "wisdom": 0 },
          "skills": [] }
      }
    ]
  }
}
