{ "id": "the-shadow-clones",
  "name": "The Shadow Clones",
  "shortName": "TSC",
  "color": "#646364",
  "categories": {
    "sprint": [
      { "trainer": "ChooChoo",
        "locked": true,
        "uma": { "name": "Mayano Top Gun",
          "spriteId": 102402,
          "rating": "SS+",
          "style": "late",
          "aptitudes": { "terrain": "A", "distance": "S", "style": "A" },
          "stats": { "speed": 1253, "stamina": 618, "power": 1204, "guts": 631, "wisdom": 980 },
          "skills": ["Flowery☆Maneuver","Let's Pump Some Iron!","Budding Blossom","Right-Handed","Professor of Curvature","Straightaway Adept","It's On!","No Stopping Me!","Homestretch Haste","Position Pilfer","On Your Left!","Late Surger Straightaways","Late Surger Corners","Uma Stan","Tail Held High","Risky Business","Burning Spirit SPD","Ignited Spirit PWR","Ignited Spirit GUTS"] }
      },
      { "trainer": "Hikaru Kogane",
        "locked": true,
        "uma": { "name": "Nishino Flower",
          "spriteId": 105101,
          "rating": "SS+",
          "style": "pace",
          "aptitudes": { "terrain": "A", "distance": "S", "style": "A" },
          "stats": { "speed": 1306, "stamina": 428, "power": 1228, "guts": 372, "wisdom": 1248 },
          "skills": ["Budding Blossom","Shooting for Victory!","I Never Goof Up!","Right-Handed","Professor of Curvature","Beeline Burst","It's On!","No Stopping Me!","Prepared to Pass","Pace Chaser Corners","Tail Held High","Playtime's Over!","Neck and Neck","On the Attack"] }
      },
      { "trainer": "New Team sprint 3",
        "uma": { "name": "Uma Name",
          "characterId": "",
          "rating": "S",
          "style": "front",
          "aptitudes": { "terrain": "A", "distance": "A", "style": "A" },
          "stats": { "speed": 0, "stamina": 0, "power": 0, "guts": 0, "wisdom": 0 },
          "skills": [] }
      }
    ],
    "mile": [
      { "trainer": "Dragon",
        "locked": true,
        "uma": { "name": "Daiwa Scarlet",
          "spriteId": 100901,
          "rating": "S+",
          "style": "front",
          "aptitudes": { "terrain": "A", "distance": "S", "style": "S" },
          "stats": { "speed": 1270, "stamina": 516, "power": 1250, "guts": 362, "wisdom": 840 },
          "skills": ["Resplendent Red Ace","The Duty of Dignity Calls","All Charged! It's Go Time!","Operation Cacao","Summer Runner","Competitive Spirit","Corner Adept","Focus","Prudent Positioning","Ramp Up","Final Push","Unyielding Spirit","Top Runner","Second Wind","Front Runner Savvy","Lucky Seven","Groundwork","Burning Spirit SPD","Ignited Spirit PWR"] }
      },
      { "trainer": "New Team mile 2",
        "uma": { "name": "Uma Name",
          "characterId": "",
          "rating": "S",
          "style": "front",
          "aptitudes": { "terrain": "A", "distance": "A", "style": "A" },
          "stats": { "speed": 0, "stamina": 0, "power": 0, "guts": 0, "wisdom": 0 },
          "skills": [] }
      },
      { "trainer": "New Team mile 3",
        "uma": { "name": "Uma Name",
          "characterId": "",
          "rating": "S",
          "style": "front",
          "aptitudes": { "terrain": "A", "distance": "A", "style": "A" },
          "stats": { "speed": 0, "stamina": 0, "power": 0, "guts": 0, "wisdom": 0 },
          "skills": [] }
      }
    ],
    "medium": [
      { "trainer": "arene_",
        "uma": { "name": "Tamamo Cross",
          "spriteId": 102101,
          "rating": "UG1",
          "style": "late",
          "aptitudes": { "terrain": "S", "distance": "A", "style": "A" },
          "stats": { "speed": 1252, "stamina": 814, "power": 1226, "guts": 546, "wisdom": 1171 },
          "skills": ["White Lightning Comin' Through!","Moving Past, and Beyond","Right-Handed","Spring Runner","Professor of Curvature","It's On!","No Stopping Me!","Fast & Furious","Late Surger Straightaways","Late Surger Corners","Uma Stan","Tail Nine","All I've Got","Burning Spirit SPD"] }
      },
      { "trainer": "New Team medium 2",
        "uma": { "name": "Uma Name",
          "characterId": "",
          "rating": "S",
          "style": "front",
          "aptitudes": { "terrain": "A", "distance": "A", "style": "A" },
          "stats": { "speed": 0, "stamina": 0, "power": 0, "guts": 0, "wisdom": 0 },
          "skills": [] }
      },
      { "trainer": "New Team medium 3",
        "uma": { "name": "Uma Name",
          "characterId": "",
          "rating": "S",
          "style": "front",
          "aptitudes": { "terrain": "A", "distance": "A", "style": "A" },
          "stats": { "speed": 0, "stamina": 0, "power": 0, "guts": 0, "wisdom": 0 },
          "skills": [] }
      }
    ],
    "long": [
      { "trainer": "New Team long 1",
        "uma": { "name": "Uma Name",
          "characterId": "",
          "rating": "S",
          "style": "front",
          "aptitudes": { "terrain": "A", "distance": "A", "style": "A" },
          "stats": { "speed": 0, "stamina": 0, "power": 0, "guts": 0, "wisdom": 0 },
          "skills": [] }
      },
      { "trainer": "New Team long 2",
        "uma": { "name": "Uma Name",
          "characterId": "",
          "rating": "S",
          "style": "front",
          "aptitudes": { "terrain": "A", "distance": "A", "style": "A" },
          "stats": { "speed": 0, "stamina": 0, "power": 0, "guts": 0, "wisdom": 0 },
          "skills": [] }
      },
      { "trainer": "New Team long 3",
        "uma": { "name": "Uma Name",
          "characterId": "",
          "rating": "S",
          "style": "front",
          "aptitudes": { "terrain": "A", "distance": "A", "style": "A" },
          "stats": { "speed": 0, "stamina": 0, "power": 0, "guts": 0, "wisdom": 0 },
          "skills": [] }
      }
    ],
    "dirt": [
      { "trainer": "New Team dirt 1",
        "uma": { "name": "Uma Name",
          "characterId": "",
          "rating": "S",
          "style": "front",
          "aptitudes": { "terrain": "A", "distance": "A", "style": "A" },
          "stats": { "speed": 0, "stamina": 0, "power": 0, "guts": 0, "wisdom": 0 },
          "skills": [] }
      },
      { "trainer": "New Team dirt 2",
        "uma": { "name": "Uma Name",
          "characterId": "",
          "rating": "S",
          "style": "front",
          "aptitudes": { "terrain": "A", "distance": "A", "style": "A" },
          "stats": { "speed": 0, "stamina": 0, "power": 0, "guts": 0, "wisdom": 0 },
          "skills": [] }
      },
      { "trainer": "New Team dirt 3",
        "uma": { "name": "Uma Name",
          "characterId": "",
          "rating": "S",
          "style": "front",
          "aptitudes": { "terrain": "A", "distance": "A", "style": "A" },
          "stats": { "speed": 0, "stamina": 0, "power": 0, "guts": 0, "wisdom": 0 },
          "skills": [] }
      }
    ]
  }
}
