{ "id": "ritto-dorm-dropouts",
  "name": "Ritto Dorm Dropouts",
  "shortName": "RDD",
  "color": "#992724",
  "categories": {
    "sprint": [
      { "trainer": "New Team sprint 1",
        "uma": { "name": "Uma Name",
          "characterId": "",
          "rating": "S",
          "style": "front",
          "stats": { "speed": 0, "stamina": 0, "power": 0, "guts": 0, "wisdom": 0 },
          "skills": [] }
      },
      { "trainer": "New Team sprint 2",
        "uma": { "name": "Uma Name",
          "characterId": "",
          "rating": "S",
          "style": "front",
          "stats": { "speed": 0, "stamina": 0, "power": 0, "guts": 0, "wisdom": 0 },
          "skills": [] }
      },
      { "trainer": "New Team sprint 3",
        "uma": { "name": "Uma Name",
          "characterId": "",
          "rating": "S",
          "style": "front",
          "stats": { "speed": 0, "stamina": 0, "power": 0, "guts": 0, "wisdom": 0 },
          "skills": [] }
      }
    ],
    "mile": [
      { "trainer": "RDD | Simon",
        "uma": { "name": "Vodka",
          "spriteId": 100801,
          "rating": "SS+",
          "style": "late",
          "stats": { "speed": 1220, "stamina": 595, "power": 1169, "guts": 513, "wisdom": 1159 },
          "skills": [] }
      },
      { "trainer": "RDD||Lyonn",
        "uma": { "name": "Yaeno Muteki",
          "spriteId": 107201,
          "rating": "UG",
          "style": "pace",
          "stats": { "speed": 1234, "stamina": 707, "power": 1198, "guts": 559, "wisdom": 1151 },
          "skills": [] }
      },
      { "trainer": "New Team mile 3",
        "uma": { "name": "Uma Name",
          "characterId": "",
          "rating": "S",
          "style": "front",
          "stats": { "speed": 0, "stamina": 0, "power": 0, "guts": 0, "wisdom": 0 },
          "skills": [] }
      }
    ],
    "medium": [
      { "trainer": "New Team medium 1",
        "uma": { "name": "Uma Name",
          "characterId": "",
          "rating": "S",
          "style": "front",
          "stats": { "speed": 0, "stamina": 0, "power": 0, "guts": 0, "wisdom": 0 },
          "skills": [] }
      },
      { "trainer": "New Team medium 2",
        "uma": { "name": "Uma Name",
          "characterId": "",
          "rating": "S",
          "style": "front",
          "stats": { "speed": 0, "stamina": 0, "power": 0, "guts": 0, "wisdom": 0 },
          "skills": [] }
      },
      { "trainer": "New Team medium 3",
        "uma": { "name": "Uma Name",
          "characterId": "",
          "rating": "S",
          "style": "front",
          "stats": { "speed": 0, "stamina": 0, "power": 0, "guts": 0, "wisdom": 0 },
          "skills": [] }
      }
    ],
    "long": [
      { "trainer": "Darth bobcat",
        "uma": { "name": "Super Creek",
          "spriteId": 104501,
          "rating": "UG",
          "style": "pace",
          "stats": { "speed": 1318, "stamina": 779, "power": 1064, "guts": 582, "wisdom": 1208 },
          "skills": [] }
      },
      { "trainer": "New Team long 2",
        "uma": { "name": "Uma Name",
          "characterId": "",
          "rating": "S",
          "style": "front",
          "stats": { "speed": 0, "stamina": 0, "power": 0, "guts": 0, "wisdom": 0 },
          "skills": [] }
      },
      { "trainer": "New Team long 3",
        "uma": { "name": "Uma Name",
          "characterId": "",
          "rating": "S",
          "style": "front",
          "stats": { "speed": 0, "stamina": 0, "power": 0, "guts": 0, "wisdom": 0 },
          "skills": [] }
      }
    ],
    "dirt": [
      { "trainer": "BajaBlast",
        "uma": { "name": "Oguri Cap",
          "spriteId": 100601,
          "rating": "UG",
          "style": "pace",
          "stats": { "speed": 1250, "stamina": 493, "power": 1217, "guts": 491, "wisdom": 1269 },
          "skills": [] }
      },
      { "trainer": "New Team dirt 2",
        "uma": { "name": "Uma Name",
          "characterId": "",
          "rating": "S",
          "style": "front",
          "stats": { "speed": 0, "stamina": 0, "power": 0, "guts": 0, "wisdom": 0 },
          "skills": [] }
      },
      { "trainer": "New Team dirt 3",
        "uma": { "name": "Uma Name",
          "characterId": "",
          "rating": "S",
          "style": "front",
          "stats": { "speed": 0, "stamina": 0, "power": 0, "guts": 0, "wisdom": 0 },
          "skills": [] }
      }
    ]
  }
}
